{
  "schema": "pliego.render-request",
  "version": 1,
  "api": 2,
  "profile": null,
  "input": {
    "entrypoint": "document.html",
    "manifest": {
      "path": "input-manifest.json",
      "media_type": "application/vnd.pliego.input-manifest+json",
      "sha256": "sha256:65fb0708211a8786d538d1940dd924f8e60e9cc875d6f3fde552b763f3f71907",
      "bytes": 723
    }
  },
  "environment": {
    "locale": "en-US",
    "timezone": "UTC"
  },
  "page": {
    "size": {
      "name": "A4"
    },
    "margins_app_units": {
      "top": 2880,
      "right": 2880,
      "bottom": 2880,
      "left": 2880
    },
    "css_page_precedence": "css-page-over-request-defaults"
  },
  "resources": {
    "network": "deny",
    "host_fonts": "deny"
  },
  "time": {
    "policy_version": 1,
    "epoch_unix_ms": 946684800000,
    "initial_offset_ns": 0
  },
  "settlement": {
    "policy_version": 1,
    "infinite_source_policy": "fail",
    "empty_checkpoints": 2,
    "limits": {
      "virtual_span_ms": 86400000,
      "ordinary_tasks": 100000,
      "microtasks": 1000000,
      "rendering_opportunities": 10000,
      "mutations": 1000000,
      "post_readiness_resources": 1024,
      "process_cpu_ms": 30000,
      "host_wall_ms": 60000
    }
  },
  "diagnostics": {
    "retention": "always"
  }
}
